[
  {
    "id": "retro-car/body",
    "package": "retro-car",
    "kind": "model",
    "file": "assets/car/Car.fbx",
    "bytes": 142844,
    "by": "Bricchi Games",
    "license": "CC-BY-4.0",
    "source": "https://bricchi-games.itch.io/retro-car-with-interior",
    "credit": "Retro Car With Interior (PSX asset) by Bricchi Games, CC BY 4.0",
    "use": "Every car: body, doors, hood, trunk lid, wheels and steering wheel. Scaled to 4.73 m long, wheels on the ground. Its credit stays with the game.",
    "bounds": { "min": [-0.86, 0, -2.365], "max": [0.86, 1.48, 2.365] },
    "collider": {
      "shape": "box",
      "hw": 0.97,
      "hl": 2.5,
      "bottom": 0.22,
      "top": 1.48,
      "note": "Includes the rubber bumpers."
    },
    "anchors": {
      "frame": "Car-local metres: [left, up, forward], from the middle of the car on the ground.",
      "seats": {
        "driver": { "at": [0.4, 1.16, 0.02], "eye": [0.38, 1.2, 0.08] },
        "hood": { "at": [0.4, 1.14, -0.85] },
        "trunk": { "at": [-0.4, 1.14, -0.85] },
        "mechanic": { "at": [-0.4, 1.16, 0.02], "eye": [-0.38, 1.2, 0.08] }
      },
      "turrets": {
        "hood": {
          "at": [0, 0.915, 1.45],
          "on": "car_hood",
          "camera": { "back": 1.3, "up": 0.68, "tilt": -0.08 }
        },
        "trunk": {
          "at": [0, 0.84, -1.72],
          "on": "trunk",
          "camera": { "back": 1.3, "up": 0.72, "tilt": -0.08 }
        },
        "muzzle": {
          "pivot": 0.17,
          "length": 0.66,
          "note": "The barrel pivots 0.17 m above its mount; balls leave 0.66 m along it."
        }
      },
      "radar": { "at": [0, 1.48, -0.62], "head": 0.22, "hitRadius": 0.28 },
      "exhausts": [
        [0.42, 0.3, -2.55],
        [-0.42, 0.3, -2.55]
      ],
      "wheels": {
        "at": [
          [0.71, 1.281],
          [-0.7, 1.281],
          [0.71, -1.123],
          [-0.7, -1.123]
        ],
        "radius": 0.289,
        "wheelbase": 2.4,
        "order": "front left, front right, rear left, rear right; [left, forward]"
      },
      "glass": {
        "shield": {
          "y": 0.932,
          "z": 0.94,
          "uy": 0.72,
          "uz": -0.694,
          "ny": 0.694,
          "nz": 0.72,
          "rx": -0.767,
          "len": 0.706
        },
        "rear": {
          "y": 0.903,
          "z": -1.317,
          "uy": 0.821,
          "uz": 0.572,
          "ny": 0.572,
          "nz": -0.821,
          "rx": 0.609,
          "len": 0.642
        },
        "note": "The windscreens: bottom edge (y, z), the way up the glass (uy, uz), its outward normal (ny, nz), half its width (rx) and its length."
      },
      "numbers": {
        "roof": [0, 1.486, -0.1],
        "doors": [
          [0.845, 0.7, 0.42],
          [-0.845, 0.7, 0.42]
        ]
      },
      "parts": ["car_hood", "trunk", "L_Door_Front", "R_Door_Front", "L_Door_Back", "R_Door_Back"],
      "paintAtlas": {
        "W": 432,
        "H": 576,
        "PX": 88,
        "ZMIN": -2.45,
        "YMAX": 1.55,
        "XMIN": -0.95,
        "L": [0, 0, 431, 136],
        "R": [0, 136, 431, 136],
        "T": [0, 272, 431, 167],
        "F": [0, 439, 167, 136],
        "B": [168, 439, 167, 136],
        "note": "Where paint splats are kept: the car seen from the left, right, top, front and back at 88 px a metre."
      }
    },
    "palette": {
      "paint": "team: the paint mask takes the team colour",
      "glass": "#1b2833",
      "rubber": "#1c1c1f",
      "trim": "team ui colour"
    },
    "lod": [{ "triangles": 2960 }]
  },
  {
    "id": "retro-car/paint",
    "package": "retro-car",
    "kind": "texture",
    "file": "assets/car/car-paint-base.jpg",
    "bytes": 334611,
    "by": "Bricchi Games",
    "license": "CC-BY-4.0",
    "source": "https://bricchi-games.itch.io/retro-car-with-interior",
    "credit": "Retro Car With Interior (PSX asset) by Bricchi Games, CC BY 4.0",
    "use": "The car's texture, with the body in white so any team colour can tint it."
  },
  {
    "id": "retro-car/mask",
    "package": "retro-car",
    "kind": "texture",
    "file": "assets/car/car-paint-mask.png",
    "bytes": 10770,
    "by": "Bricchi Games",
    "license": "CC-BY-4.0",
    "source": "https://bricchi-games.itch.io/retro-car-with-interior",
    "credit": "Retro Car With Interior (PSX asset) by Bricchi Games, CC BY 4.0",
    "use": "Where the paint is on the texture: the team colour goes there, and the dents, scrapes and rust."
  },
  {
    "id": "retro-car/lights",
    "package": "retro-car",
    "kind": "texture",
    "file": "assets/car/car-emissive.png",
    "bytes": 4065,
    "by": "Bricchi Games",
    "license": "CC-BY-4.0",
    "source": "https://bricchi-games.itch.io/retro-car-with-interior",
    "credit": "Retro Car With Interior (PSX asset) by Bricchi Games, CC BY 4.0",
    "use": "The head- and taillights, which glow until that end of the car is smashed."
  },
  {
    "id": "font/bungee",
    "package": "fonts",
    "kind": "font",
    "file": "assets/fonts/Bungee-400.woff2",
    "bytes": 14296,
    "by": "The Bungee Project Authors",
    "license": "OFL-1.1",
    "source": "https://github.com/djrrb/Bungee",
    "licenseFile": "assets/fonts/Bungee-OFL.txt",
    "use": "Titles and big call-outs: the countdown, WINS, FIXED!."
  },
  {
    "id": "font/barlow-condensed-500",
    "package": "fonts",
    "kind": "font",
    "file": "assets/fonts/BarlowCondensed-500.woff2",
    "bytes": 14680,
    "by": "The Barlow Project Authors",
    "license": "OFL-1.1",
    "source": "https://github.com/jpt/barlow",
    "licenseFile": "assets/fonts/BarlowCondensed-OFL.txt",
    "use": "HUD and menu text (weight 500)."
  },
  {
    "id": "font/barlow-condensed-600",
    "package": "fonts",
    "kind": "font",
    "file": "assets/fonts/BarlowCondensed-600.woff2",
    "bytes": 14844,
    "by": "The Barlow Project Authors",
    "license": "OFL-1.1",
    "source": "https://github.com/jpt/barlow",
    "licenseFile": "assets/fonts/BarlowCondensed-OFL.txt",
    "use": "HUD and menu text (weight 600)."
  },
  {
    "id": "font/barlow-condensed-700",
    "package": "fonts",
    "kind": "font",
    "file": "assets/fonts/BarlowCondensed-700.woff2",
    "bytes": 14888,
    "by": "The Barlow Project Authors",
    "license": "OFL-1.1",
    "source": "https://github.com/jpt/barlow",
    "licenseFile": "assets/fonts/BarlowCondensed-OFL.txt",
    "use": "HUD and menu text (weight 700)."
  },
  {
    "id": "car/turret",
    "package": "car",
    "kind": "model",
    "by": "Matapao",
    "license": "MIT",
    "file": null,
    "source": "procedural: src/car.ts",
    "bytes": 0,
    "use": "The little remote paintball turret: a ring, the housing, the barrel, a hopper of team-coloured balls and the camera its gunner watches.",
    "bounds": { "min": [-0.195, 0, -0.2], "max": [0.195, 0.45, 0.7] },
    "lod": [{ "triangles": 200 }],
    "palette": {
      "metal": "#2b2d31",
      "barrel": "#17181b",
      "balls": "team ui colour",
      "lens": "#0d1a24",
      "light": "#ff2a2a"
    }
  },
  {
    "id": "car/radar",
    "package": "car",
    "kind": "model",
    "by": "Matapao",
    "license": "MIT",
    "file": null,
    "source": "procedural: src/radar.ts",
    "bytes": 0,
    "use": "The roof radar: a mast and a spinning head with a team-coloured face and a green lamp. Knocked off, it flies away.",
    "bounds": { "min": [-0.29, 0, -0.12], "max": [0.29, 0.255, 0.12] },
    "lod": [{ "triangles": 100 }],
    "palette": { "metal": "#17181b", "face": "team ui colour", "lamp": "#5bff9a" }
  },
  {
    "id": "car/bumpers",
    "package": "car",
    "kind": "model",
    "by": "Matapao",
    "license": "MIT",
    "file": null,
    "source": "procedural: src/car.ts",
    "bytes": 0,
    "use": "The fat rubber bumpers round the front, the back and along the doors, black with a strip in the team colour: ten pieces that tear off one by one.",
    "palette": { "rubber": "#1c1c1f", "strip": "team ui colour" }
  },
  {
    "id": "car/crew",
    "package": "car",
    "kind": "model",
    "by": "Matapao",
    "license": "MIT",
    "file": null,
    "source": "procedural: src/car.ts",
    "bytes": 0,
    "use": "A crew member in a seat (suit, helmet, visor); the gunners wear glowing camera goggles.",
    "palette": {
      "suit": "#9e9eab",
      "helmet": "team paint, lightened",
      "visor": "#101214",
      "goggles": "#3ad7ff"
    }
  },
  {
    "id": "kit/bar",
    "package": "kit-parts",
    "kind": "model",
    "by": "Matapao",
    "license": "MIT",
    "file": null,
    "source": "procedural: src/kits.ts",
    "bytes": 0,
    "use": "A light bar across the front.",
    "bounds": { "min": [-0.625, -0.025, -0.03], "max": [0.625, 0.025, 0.03] },
    "lod": [{ "triangles": 12 }]
  },
  {
    "id": "kit/spot",
    "package": "kit-parts",
    "kind": "model",
    "by": "Matapao",
    "license": "MIT",
    "file": null,
    "source": "procedural: src/kits.ts",
    "bytes": 0,
    "use": "A round spot lamp housing.",
    "bounds": { "min": [-0.093, -0.11, -0.045], "max": [0.093, 0.095, 0.045] },
    "lod": [{ "triangles": 68 }]
  },
  {
    "id": "kit/lens",
    "package": "kit-parts",
    "kind": "model",
    "by": "Matapao",
    "license": "MIT",
    "file": null,
    "source": "procedural: src/kits.ts",
    "bytes": 0,
    "use": "A spot lamp lens (glows).",
    "bounds": { "min": [-0.072, -0.074, 0.042], "max": [0.072, 0.074, 0.052] },
    "lod": [{ "triangles": 56 }]
  },
  {
    "id": "kit/scoop",
    "package": "kit-parts",
    "kind": "model",
    "by": "Matapao",
    "license": "MIT",
    "file": null,
    "source": "procedural: src/kits.ts",
    "bytes": 0,
    "use": "A roof scoop.",
    "bounds": { "min": [-0.23, -0.04, -0.17], "max": [0.23, 0.04, 0.18] },
    "lod": [{ "triangles": 24 }]
  },
  {
    "id": "kit/flap",
    "package": "kit-parts",
    "kind": "model",
    "by": "Matapao",
    "license": "MIT",
    "file": null,